55,北京大學,Peking University,中國,China,https://oia.ntu.edu.tw/outgoing/view/semester/1/sn/55,是,中語組,GPA 達3.30分以上,大二/大三/碩一/碩二(不含博士生)學生,無,醫學部、光華管理學院,一學期5名,該校年曆： 北京大学校历 [https://www.pku.edu.cn/campus.html#p3a],須在本校註冊並繳交全額學雜費，免繳該校學費，但該校雜費、住宿費、生活費、保險費、往返機票費等均須自行負擔,住宿由校方安排。 港澳台交換學生將被安排到校內學生宿舍（四人一間） 住宿費：預估人民幣 750 元 / 學期,請留意，該校表示因無法評估未來疫情之影響，即使提供交換名額予本校，仍有可能會臨時取消交換學生計畫。 另， 陸港澳地區調升為橙色旅遊警示 [https://www.mac.gov.tw/News_Content.aspx?n=B383123AEADAEE52&sms=2B7F1AE4AC63A181&s=CA568B3D88264221] ，請欲選擇至該校交換的同學留意。 交換學校一覽表所列之語言能力為該校之最低門檻要求，同學需自行確認語言能力是否符合該校修課要求、查詢是否有足夠的課程可供選讀、能否達到該校之每學期修課學分數要求、以及是否具備相關領域之背景知識，若未達標準，該校有權拒收。 交換生申請人必須成績優良。有不合格科目或專業課成績不佳者將不予錄取。 經濟系學生僅可申請至該校經濟學院就讀，不得申請該校光華管理學院。 醫學部不接收交換生。 交換學生資訊請參考 港澳台高校学生来校交换学习事务 [https://hmt.pku.edu.cn/xssw/jhssw1/lxjhs.htm] 本科生資訊請參考 北京大学教务部 [http://www.dean.pku.edu.cn/web/student.php] 研究生資訊請參考 北京大学研究生招生网 [https://admission.pku.edu.cn/] 本科生一学期至少选修四门课，可以跨院系选课，但专业课要在跨院系选课阶段选； 研究生一学期至少选4学分课程或两门课 交換生在學期結束後，須向北京大學提交一份交換心得。 交換生交換期間不可有兼職工作。 不接受非中華民國國籍學生。,40.1733653,116.15722
59,布魯塞爾自由大學,Université Libre de Bruxelles,比利時,Belgium,https://oia.ntu.edu.tw/outgoing/view/semester/1/sn/59,否,法語組,無,大二以上/碩一以上(不含博士生)學生,具法語檢定成績 B1(中級) 級以上,管理學院、醫學院、公共衛生學院、翻譯與口譯學院,全學年1名,Academic Calendar [https://www.ulb.be/fr/documents-officiels/calendrier-academique-harmonise-2025-2026] Semester 1: September to January Semester 2: February to June Full academic year: September to June,須在本校註冊並繳交全額學雜費，免繳該校學費，但該校雜費、住宿費、生活費、保險費、往返機票費等均須自行負擔,"ULB offers a wide choice of accommodation [https://www.ulb.be/en/campus-life/accommodation] in its own halls of residence and private halls of residence, either on one of its three campuses (Solbosch, La Plaine, Erasme) or off-campus (with over 2,400 rooms or flats). The Housing Office will help you to find a suitable accommodation and advise you on many aspects of student housing.","交換學校一覽表所列之語言能力為該校之最低門檻要求，同學需自行確認語言能力是否符合該校修課要求、查詢是否有 相對應的系所及 足夠的課程可供選讀、能否達到該校之每學期修課學分數要求、以及是否具備相關領域之背景知識，若未達標準，該校有權拒收。 該校以法文授課為主，英文授課數量極少，請特別留意。 Website [https://www.ulb.be/en/incoming-mobility/sudents-coming-from-an-institution-outside-europe] of incoming exchange student information Link [https://www.ulb.be/fr/etudier/programme] to course catalogue index Fields of Study : Philosophy and Social Sciences / Letters, Translation Interpreting and Communication (including the Translation and Interpreting School) / Law and Criminology / Economics and Management / Engineering / Psychological and Educational Sciences / Architecture / Sciences / Medicine and Public Health / Pharmacy / Motor Sciences Solvay, Medicine, ISTI, these faculties sign their own convention directely with their partners. Solvay Brussels school of Economics and Management 與本校管理學院簽有院級交換合約，因此本志願不接受管院學生申請。",50.8134718,4.3812357
60,智利天主教大學,Pontificia Universidad Católica de Chile (UC Chile),智利,Chile,https://oia.ntu.edu.tw/outgoing/view/semester/1/sn/60,是,西語組,GPA 達3.70分以上,大二以上(僅限大學部)學生,具西語檢定成績 B2(中高級) 級以上，DELE or SIELE,醫學院、公共衛生學院,全學年2名,First Semester: March - July Second Semester: August - December ✔ 該校年曆請參考 此連結 [https://www.uc.cl/calendario-academico/],須在本校註冊並繳交全額學雜費，免繳該校學費，但該校雜費、住宿費、生活費、保險費、往返機票費等均須自行負擔,不保證住宿。 The University does not have any type of student dormitories or residencies nor coordinates housing for international students.,"交換學校一覽表所列之語言能力為該校之最低門檻要求，同學需自行確認語言能力是否符合該校修課要求、查詢是否有相對應系所及足夠的課程可供選讀、能否達到該校之每學期修課學分數要求、以及是否具備相關領域之背景知識，若未達標準，該校有權拒收。 交換學生資訊請參考 此連結 [https://internacionalizacion.uc.cl/quiero-ir-a-la-uc/viajar-a-la-uc/semestre-o-ano-en-la-uc/exchange/] 及 Fact Sheet [https://studyabroad.ntu.edu.tw/wp-content/uploads/2025/10/UC-Chile-Fact-Sheet-Global-Mobility-2026.pdf] 課程資訊請參考 此連結 [https://internacionalizacion.uc.cl/en/come-to-uc/course-catalog/] 、語言課程請參考 此連結 [https://letras.uc.cl/programas-de-servicio/espanol-uc/] 欲選填該校為志願的同學，請務必先行詳閱系所限制，自行評估是否符合該校規定： Restricted programs of Study [https://internacionalizacion.uc.cl/en/come-to-uc/exchange/] （Áreas de estudio restringidas部分） Medicine, Health sciences, and Nursing students may come, but those faculties are closed for exchange students. They may take elective courses only. Credits of a curricular activity [https://admisionyregistros.uc.cl/alumnos/cursos/creditos-de-una-actividad-curricular] All exchange students need to purchase full coverage international health insurance in their countries of origin before coming to Chile. International students must have a good command of the Spanish language . Those who are not native Spanish speakers must meet the accredited B2 level language requirement (according to CEFR) (present a DELE, SIELE certificate or a letter from the Spanish department of the university of origin accrediting the B2 level). Summer schools, internship are also available and open for exchange programs.",-33.4548376,-70.5943911
61,哥本哈根大學,University of Copenhagen,丹麥,Denmark,https://oia.ntu.edu.tw/outgoing/view/semester/1/sn/61,否,一般組,無,大二以上/碩一以上(不含博士生)學生,TOEFL iBT 80 (接受 Home Edition) 或 IELTS 6.0,醫學院、公共衛生學院,全學年3名,Fall semester start - 1 September to 31 January Spring semester start - 1 February to 30 June,須在本校註冊並繳交全額學雜費，免繳該校學費，但該校雜費、住宿費、生活費、保險費、往返機票費等均須自行負擔,"Not guaranteed, but students can apply for housing. For housing information, please check this website [https://housingfoundation.dk/] .",交換學校一覽表所列之語言能力為該校之最低門檻要求，同學需自行確認語言能力是否符合該校修課要求、查詢是否有 相對應的系所及 足夠的課程可供選讀、能否達到該校之每學期修課學分數要求、以及是否具備相關領域之背景知識，若未達標準，該校有權拒收。 Website [https://studies.ku.dk/study-abroad/overseas/] for incoming exchange student program Course catalogue [https://studies.ku.dk/study-abroad/exchange/course-information/] 各院系之申請限制 [https://studies.ku.dk/study-abroad/exchange/course-information/course-requirements-and-restrictions/] （請務必詳閱！）,55.6801502,12.572327
62,赫爾辛基大學,University of Helsinki,芬蘭,Finland,https://oia.ntu.edu.tw/outgoing/view/semester/1/sn/62,否,一般組,無,大二以上/碩一以上(不含博士生)學生,TOEFL iBT 79 (接受 Home Edition) 或 IELTS 6.0 或 全民英檢中高級,管理學院、工學院、醫學院護理學系、醫學院護理學研究所、醫學院牙醫學系、醫學院臨床牙醫學研究所,全學年3名,Academic Calendar [https://studies.helsinki.fi/instructions/article/academic-year-and-teaching-periods#paragraph-594],須在本校註冊並繳交全額學雜費，免繳該校學費，但該校雜費、住宿費、生活費、保險費、往返機票費等均須自行負擔,"Not guaranteed, but students can apply for housing. More information here [https://studies.helsinki.fi/instructions/article/housing] . Mandatory fees prior to arrival: room deposit: €500 (subject to change) to be paid to the housing provider according to their instructions. Students should be prepared to pay the deposit when they receive instructions from the housing provider. This can be several months prior to arrival.","交換學校一覽表所列之語言能力為該校之最低門檻要求，同學需自行確認語言能力是否符合該校修課要求、查詢是否有相對應的系所及足夠的課程可供選讀、能否達到該校之每學期修課學分數要求、以及是否具備相關領域之背景知識，若未達標準，該校有權拒收。 Website [https://studies.helsinki.fi/instructions/exchange-and-visiting-students] of incoming exchange student information Course catalogue [https://studies.helsinki.fi/instructions/article/where-can-i-find-courses] Faculties and Units [https://www.helsinki.fi/en/faculties-and-units] Fields NOT offered at the University of Helsinki: Business, Engineering, Nursing, Architecture and Fine Arts. Dentistry is NOT open to exchange students. Restrictions in attending courses [https://studies.helsinki.fi/instructions/article/courses-exchange-students#paragraph-7853] University level bilateral exchange students are required to choose the majority of their courses from one faculty, closest to their educational background. Exchange students need to have sufficient prior academic background in the disciplines taught at the receiving Faculty. Within one faculty, they can choose courses from several study programmes. One of the study programmes will be chosen as the host study programme for the student. Students are welcome to choose some courses from other faculties, as well, if they meet the requirements for the courses. The following have a more extensive requirement: The prerequisite for Medicine is two full years of pre-clinical and one full year of clinical studies. In Psychology (Faculty of Medicine), the prerequisite is two full years of university-level studies in Psychology. Medicine and Psychology are also highly restricted and access to them cannot be guaranteed to exchange students admitted via university-wide agreements. For Life Sciences (the faculties of Agriculture and Forestry, Biological and Environmental Sciences, and Pharmacy), the prerequisite for studies in Helsinki is two years of completed university studies in the field in question. Please note that some faculties/study programmes offer courses in English mainly on Master's level (suitable for advanced Bachelor students as well): Agriculture and Forestry, Biological and Environmental Sciences, Geography, Law, Pharmacy, and Translational Medicine. Minimum academic workload per semester: 20 ECTS. One ECTS credit equals 27 hours of work, including both lectures and homework.",60.2267221,25.01767
63,科諾伯勒阿爾卑斯大學,University Grenoble Alpes (UGA),法國,France,https://oia.ntu.edu.tw/outgoing/view/semester/1/sn/63,否,法語組,無,大二以上/碩一以上(不含博士生)學生,TOEFL iBT 79 (接受 Home Edition) 或 IELTS 6.0 或 全民英檢中高級；或具法語檢定成績 B2(中高級) 級以上,醫學院、公共衛生學院,全學年2名,The academic calendar [https://www.univ-grenoble-alpes.fr/university-calendar/university-calendar-626639.kjsp?RH=1610017399507] may be different depending on the host faculty.,須在本校註冊並繳交全額學雜費，免繳該校學費，但該校雜費、住宿費、生活費、保險費、往返機票費等均須自行負擔,"Accepted students will receive an e-mail, with login details to access the online accommodation platform. The deadlines will be specified when the housing procedure will be sent. Students who meet the deadlines will receive one offer of accommodation only from the International Students & Scholars Office (ISSO) [https://international.univ-grenoble-alpes.fr/getting-organized/accommodation/looking-for-accommodation/] .","交換學校一覽表所列之語言能力為該校之最低門檻要求，同學需自行確認語言能力是否符合該校修課要求、查詢是否有 相對應的系所及 足夠的課程可供選讀、能否達到該校之每學期修課學分數要求、以及是否具備相關領域之背景知識，若未達標準，該校有權拒收。 Website [https://international.univ-grenoble-alpes.fr/come-to-uga/exchange-programs/come-on-exchange/come-on-exchange-784754.kjsp?RH=1610017301259] of incoming exchange student information Course catalogue [http://formations.univ-grenoble-alpes.fr/coursecatalog] Programs in English [https://international.univ-grenoble-alpes.fr/programs-in-english-786070.kjsp?RH=1602595298609] Medicine, the CUEF (University Center of French Studies) are NOT open to exchange students List of faculties [https://www.univ-grenoble-alpes.fr/education/programs/exchange-programs/uga-faculties-international-relations-offices-634837.kjsp] : disciplines, level of study and language required, administrative and Academic Contacts Two campuses: Grenoble [https://international.univ-grenoble-alpes.fr/about/an-exceptional-environment/grenoble-campus/grenoble-713853.kjsp?RH=1610011642050] , Valence [https://international.univ-grenoble-alpes.fr/about/an-exceptional-environment/valence-campus/]",44.9253263,4.9275317
65,尚慕蘭里昂第三大學,University Jean Moulin - Lyon 3,法國,France,https://oia.ntu.edu.tw/outgoing/view/semester/1/sn/65,否,法語組,無,大二以上/碩一以上/博一以上學生,TOEFL iBT 80 (讀 20 聽 20 說 20 寫 20 不接受 Home Edition) 或 IELTS 6.5 (聽 6.0 讀 6.0 寫 6.0 說 6.0)；或具法語檢定成績 B1(中級) 級以上,無,全學年2名,Academic Calendar [https://www.univ-lyon3.fr/calendar-self-and-deuf],須在本校註冊並繳交全額學雜費，免繳該校學費，但該校雜費、住宿費、生活費、保險費、往返機票費等均須自行負擔,Finding accommodation [https://www.univ-lyon3.fr/se-loger-a-lyon] in Lyon can sometimes be difficult. Start your search before your arrival and plan for temporary accommodation.,交換學校一覽表所列之語言能力為該校之最低門檻要求，同學需自行確認語言能力是否符合該校修課要求、查詢是否有相對應的系所及足夠的課程可供選讀、能否達到該校之每學期修課學分數要求、以及是否具備相關領域之背景知識，若未達標準，該校有權拒收。 該校交換生計畫請參考 此網頁 [https://www.univ-lyon3.fr/exchange-students-1] ， 該校以人文社會學科為主，同學需自行確認是否有課程可供選讀。 交換生依授課語言不同，分為英語授課以及法語授課兩種不同Program： English SELF program [https://www.univ-lyon3.fr/self-study-in-english-in-lyon-france] 、 French DEUF program [https://www.univ-lyon3.fr/deuf-diplome-d-etudes-universitaires-francaises] Courses [https://www.univ-lyon3.fr/cours-a-choisir-dans-le-programme-deuf] to choose from in the DEUF program Master Law program and International MBA are NOT open to exchange students,45.74724928,4.860175997
66,巴黎高等政治學院,Institut d’Études Politiques de Paris (Sciences Po),法國,France,https://oia.ntu.edu.tw/outgoing/view/semester/1/sn/66,是,法語組,無,大二以上/碩一以上/博一以上學生,學士生TOEFL iBT 100 (接受 Home Edition) 或 IELTS 6.5；或具法語檢定成績 B2(中高級) 級以上；研究生TOEFL iBT 100 (接受 Home Edition) 或 IELTS 6.5；或具法語檢定成績 C1(高級) 級以上,無,全學年8名,Academic Calendar [https://www.sciencespo.fr/students/en/study/handbook/calendars.html],須在本校註冊並繳交全額學雜費，免繳該校學費，但該校雜費、住宿費、生活費、保險費、往返機票費等均須自行負擔,Students must arrange for housing on their own. More information here [https://www.sciencespo.fr/students/en/living/housing] .,"交換學校一覽表所列之語言能力為該校之最低門檻要求，同學需自行確認語言能力是否符合該校修課要求、查詢是否有相對應系所及足夠的課程可供選讀、能否達到該校之每學期修課學分數要求、以及是否具備相關領域之背景知識，若未達標準，該校有權拒收。 強烈建議具備人文、社科領域背景之同學選填 Undergraduate courses are offered in six disciplines: Economics, History, Law, the Humanities, Sociology, and Political Science (including International Relations). All 7 campuses [https://www.sciencespo.fr/college/en/campus.html] welcome exchange students Website [https://www.sciencespo.fr/college/en/academics/exchange] of incoming exchange student information From September 2025: Applicants must select 2 choices in the application form: 2 campuses for undergraduate students（不保證分配到自己第一志願校區！） 2 Master's programmes for graduate students Exchange students may register for between 5 ECTS credits (minimum) and 30 ECTS credits (maximum) per semester. Students can attempt up to 60 ECTS credits per academic year. Exchange students in our graduate programmes must be attached to a specific Masters programme and are are restricted to classes in that programme only. Not all graduate courses are open to exchange students, and some may impose academic or linguistic prerequisites.",48.8538978,2.3290212
67,特魯瓦科技大學,University of Technology of Troyes (UTT),法國,France,https://oia.ntu.edu.tw/outgoing/view/semester/1/sn/67,是,法語組,無,大二以上/碩一以上(不含博士生)學生,TOEFL iBT 79 (接受 Home Edition) 或 IELTS 6.0 或 全民英檢中高級；或具法語檢定成績 B1(中級) 級以上,無,全學年1名,Academic Calendar [https://www.utt.fr/study-at-utt/academic-calendar],須在本校註冊並繳交全額學雜費，免繳該校學費，但該校雜費、住宿費、生活費、保險費、往返機票費等均須自行負擔,"Not guaranteed, but students can apply for housing. Please check this webpage [https://www.utt.fr/study-at-utt/accommodation] for more information.",交換學校一覽表所列之語言能力為該校之最低門檻要求，同學需自行確認語言能力是否符合該校修課要求、查詢是否有相對應的系所及足夠的課程可供選讀、能否達到該校之每學期修課學分數要求、以及是否具備相關領域之背景知識，若未達標準，該校有權拒收。 Website [https://www.utt.fr/study-at-utt/application-procedure#student] of incoming exchange student information Academic programs [https://www.utt.fr/study-at-utt/academic-programs] Courses in English [https://www.utt.fr/study-at-utt/courses-in-english] All faculties are open for exchange students at the undergraduate and graduate levels if they fulfill the requirements.,48.269078,4.0664959
68,索邦大學（原皮耶及瑪麗居禮大學 ),Sorbonne University ( University Pierre and Marie CURIE ),法國,France,https://oia.ntu.edu.tw/outgoing/view/semester/1/sn/68,是,法語組,GPA 達3.00分以上,大二以上/碩一以上/博一以上學生,具法語檢定成績 B2(中高級) 級以上；或TOEFL iBT 80 (不接受 Home Edition) 或 IELTS 6.0,無,Faculty of Lettres全學年2名；Faculty of Science & Engineering全學年6名,Faculty of Lettres [https://drive.google.com/file/d/1PzGMa8wHUkjGy0XwQ5D99bpwUs33LqrD/view?usp=sharing] Faculty of Science and Engineering [https://sciences.sorbonne-universite.fr/formation-sciences/organiser-sa-scolarite-0/calendrier-universitaire],須在本校註冊並繳交全額學雜費，免繳該校學費，但該校雜費、住宿費、生活費、保險費、往返機票費等均須自行負擔,Not guaranteed but students can apply for housing. More information here [https://www.sorbonne-universite.fr/en/campus-life-1/student-life/housing] (Faculty of Lettres) and here [https://sciences.sorbonne-universite.fr/en/campus-life/life-campus/housing] (Faculty of Science and Engineering).,"交換學校一覽表所列之語言能力為該校之最低門檻要求，同學需自行確認語言能力是否符合該校修課要求、查詢是否有 相對應的系所及 足夠的課程可供選讀、能否達到該校之每學期修課學分數要求、以及是否具備相關領域之背景知識，若未達標準，該校有權拒收。 Website [https://www.sorbonne-universite.fr/en/education/study-sorbonne-university/exchange-students] of incoming exchange student information Only Faculty of Lettres [https://lettres.sorbonne-universite.fr/en/academics/international-exchange-students] and Faculty of Science and Engineering [https://sciences.sorbonne-universite.fr/international-1/venir-la-faculte/etudiantes-et-etudiants-internationaux/venir-en-programme-dechange] are open for application Faculty of Science and Engineering: Study programs in French [https://sciences.sorbonne-universite.fr/formation-sciences/offre-de-formation] Courses taught in English [https://sciences.sorbonne-universite.fr/en/courses-taught-english] L1 courses are not open to exchange students. 30 ECTS per semester. A duly filled-out-&-signed learning agreement is mandatory. Pedagogical Coordinators from both side can agree on a less-than-30-ECTS mobility. In that case, the student must provide a duly filled out-&-signed learning agreement stating the number of ECTS. Most courses hold 3 to 9 ECTS and at least 50% of the classes should be taken in the department choosen by the student",48.8468997,2.3574487
