903,墨西哥國立自治大學,Universidad Nacional Autónoma de México (UNAM),墨西哥,Mexico,https://oia.ntu.edu.tw/outgoing/view/semester/1/sn/903,是,西語組,GPA 達3.70分以上,大二以上(僅限大學部)學生,具西語檢定成績 B2(中高級) 級以上，SIELE or DELE certificate， B2 at minimum,醫學院、生物資源暨農學院獸醫學系,全學年2名,Fall Semester : August - December ( incl . final exams period) Spring Semester: January - June ( incl . final exams period) ✔ 該校年曆請參考 此連結 [https://www.dgae.unam.mx/calendarios_escolares.html],須在本校註冊並繳交全額學雜費，免繳該校學費，但該校雜費、住宿費、生活費、保險費、往返機票費等均須自行負擔,"不保證住宿 ，更多資訊請參考 此連結 [https://www.unaminternacional.unam.mx/en/blog/info-lic-estudiante-extranjero-nacional#:~:text=Does%20UNAM%20have%20housing%20or%20residences%20for%20students%3F] 。 Approved CEPE-UNAM accommodation options are offered to all accepted students, near campus.","交換學校一覽表所列之語言能力為該校之最低門檻要求，同學需自行確認語言能力是否符合該校修課要求、查詢是否有相對應系所及足夠的課程可供選讀、能否達到該校之每學期修課學分數要求、以及是否具備相關領域之背景知識，若未達標準，該校有權拒收 交換生資訊請參考 此連結 [https://www.unaminternacional.unam.mx/en/blog/info-lic-estudiante-extranjero-nacional] 及 Fact Sheet [https://studyabroad.ntu.edu.tw/wp-content/uploads/2025/03/Fact-Sheet-UNAM-ENG-2025.pdf] 、課程資訊請參考 此連結 [http://oferta.unam.mx/escuelas-facultades.html] 、語言課程資訊請參考 此連結 [http://www.cepe.unam.mx] 在具備相關領域之背景知識及選課標準的前提下，交換學生可跨領域選課，研究所學生可選修大學部課程。 Students must have completed the credits and completed at least two years of studies at the time of their application. Area of study OPEN for exchange students: Physics, Mathematics and Engineering Biological Sciences and Health Social Sciences Humanities and Arts Area of study NOT available for exchange students: Some areas in Medicine and in Veterinary Medicine. 該校各系所之交換入學申請，尚有許多附加條件，請欲選擇至該校交換的同學，於選填志願前，務必先至 Requisitos Especiales de Escuelas y Facultades (Procedure and Schools specific requirements) [https://www.unaminternacional.unam.mx/es/blog/requisitos-especiales] 查詢各系所限制。 Spanish is the primary language of instruction. However, there are some courses offered in English. No changes of campus or faculties are permitted once that acceptance letter has been issued. Medical and Travel Insurance Policy is mandatory for each student and must be contracted before travelling to Mexico. Approximate living costs per month (USD): Accommodation: $175 to $500 Food: $300 to $450 Public transportation: $40 to $60 Study material: Varies depending on study area Leisure and other expenses: $80 to $160 depending on the student",19.321597,-99.1849259
917,巴黎高等礦業學院,MINES ParisTech,法國,France,https://oia.ntu.edu.tw/outgoing/view/semester/1/sn/917,是,法語組,GPA 達3.00分以上,碩一/碩二(不含博士生)學生,TOEFL iBT 90 (不接受 Home Edition) 或 IELTS 6.5；或具法語檢定成績 B2(中高級) 級以上,無,一學期3名,Fall semester: Early September to end of January/mid-February (depending on program) Spring semester: mid-February to May,須在本校註冊並繳交全額學雜費，免繳該校學費，但該校雜費、住宿費、生活費、保險費、往返機票費等均須自行負擔,"Non-degree exchange students and visitors can apply for a room at the "" Cité internationale [https://www.ciup.fr/en/buildings-list/] "" or Crous residency through PSL housing service, but we cannot guarantee a spot.","交換學校一覽表所列之語言能力為該校之最低門檻要求，同學需自行確認語言能力是否符合該校修課要求、查詢是否有相對應的系所及足夠的課程可供選讀、能否達到該校之每學期修課學分數要求、以及是否具備相關領域之背景知識，若未達標準，該校有權拒收。 Most of the courses are taught in French. It is thus a requirement that all degree students and visiting students are proficient in French. Website [https://www.minesparis.psl.eu/formations/international/etudiants-internationaux/] of incoming exchange student information Course catalogue [https://catalogue.mines-paristech.fr/#cp=home] : Students are NOT allowed to mix courses from different programmes, tracks (for example in Master sgm) or years.",48.6117414,2.4390437
921,查理士大學,Charles University,捷克,Czech Republic,https://oia.ntu.edu.tw/outgoing/view/semester/1/sn/921,否,一般組,無,大二/大三/碩一/碩二/博一以上學生,TOEFL iBT 79 (不接受 Home Edition) 或 IELTS 6.0,無,全學年1名,Academic Calendar [https://cuni.cz/UKEN-368.html],須在本校註冊並繳交全額學雜費，免繳該校學費，但該校雜費、住宿費、生活費、保險費、往返機票費等均須自行負擔,"Please note that exchange students need to have an accommodation agreement to apply for the visa . Not guaranteed, but students can apply for housing. Accommodation of exchange students in student dormitories is arranged by the receiving faculties. Most exchange students are accommodated at the Větrník, Hvězda or Kajetánka dormitories. A catalogue of dormitories are available at the website [https://kam.cuni.cz/KAMEN-168.html] .",交換學校一覽表所列之語言能力為該校之最低門檻要求，同學需自行確認語言能力是否符合該校修課要求、查詢是否有相對應的系所及足夠的課程可供選讀、能否達到該校之每學期修課學分數要求、以及是否具備相關領域之背景知識，若未達標準，該校有權拒收。 Website [https://cuni.cz/UKEN-344.html] of incoming exchange students Courses for International Students [https://cuni.cz/UKEN-364.html] Important: NTU students participate ONLY with Faculty of Arts and Faculty of Social Science,50.0888947,14.4162757
927,廣島大學,Hiroshima University,日本,Japan,https://oia.ntu.edu.tw/outgoing/view/semester/1/sn/927,是,日語組/一般組,無,大二以上/碩一以上(不含博士生)學生,日語組：具日文檢定成績 2 級以上；一般組：TOEFL iBT 79 (不接受 Home Edition) 或 IELTS 6.0,醫學院、法律學院,日語組全學年0名；一般組全學年0名,Fall Semester: October - February Spring Semester: April - August ✔️ 該校年曆請參考 此連結 [https://momiji.hiroshima-u.ac.jp/momiji-top/en/learning/class-schedule.html],須在本校註冊並繳交全額學雜費，免繳該校學費，但該校雜費、住宿費、生活費、保險費、往返機票費等均須自行負擔,"住宿資訊請參考此連結 [https://www.hiroshima-u.ac.jp/en/nyugaku/shien/jyuukyo/gakuseisyukusya]。
University Dormitory (Ikenoue Student Dormitory)
Majority of HUSA students are housed in the Ikenoue Student Dormitory, located at ten minutes walking distance from the campus.","交換學校一覽表所列之語言能力為該校之最低門檻要求，同學需自行確認語言能力是否符合該校修課要求、查詢是否有足夠的課程可供選讀、能否達到該校之每學期修課學分數要求、以及是否具備相關領域之背景知識，若未達標準，該校有權拒收 交換生資訊及課程資訊請參考 此連結 [https://www.hiroshima-u.ac.jp/en/husa/abouthusaprogram_top/applicationreq] 、交換生語言課程資訊，請參考 此連結 [https://arc.net/l/quote/rokimgyp] 。 In the field of medicine, practicum for pedagogy, and laboratory training for science and engineering courses, etc., there are courses that are NOT open for exchange students. Students are able to take course offered in schools other than they belong to with obtaining permission from the lecturers. Hiroshima University Syllabus [https://momiji.hiroshima-u.ac.jp/syllabusHtml_en/] : Please be notified, in the field of medicine, law, practicum for pedagogy, and laboratory training for science and engineering courses, there are courses that HUSA students are NOT eligible to take. Master's/PhD students require a specific application procedure, they need to get an approval of accepting from prospect supervisor beforehand. Insurance [https://momiji.hiroshima-u.ac.jp/momiji-top/en/international/insurance.html] : Students have to enroll ""Comprehensive Insurance for Students Lives Coupled with 'Gakkensai'"" after arriving at HU. Living Expenses [https://www.hiroshima-u.ac.jp/en/husa/housing]",34.4019766,132.7123195
931,坎皮納斯州立大學,Universidade Estadual de Campinas (UNICAMP),巴西,Brazil,https://oia.ntu.edu.tw/outgoing/view/semester/1/sn/931,是,一般組,無,大二以上/碩一以上/博一以上學生,具葡萄牙語能力證明 ，B1以上檢定證書或本校修讀葡萄牙語4個學期以上成績及格證明,醫學院、音樂學院、藝術學院、體育學院，論文及畢業專題，語言課程,全學年1名,First semester: February - July Second semester: August - December ✔ 該校行事曆請參考 此連結 [https://www.dac.unicamp.br/portal/calendario],須在本校註冊並繳交全額學雜費，免繳該校學費，但住宿費、生活費、保險費、往返機票費等均須自行負擔,"不保證住宿 ，住宿資訊請參考下方說明： UNICAMP does not have a student residence and does not offer housing for students. Therefore, it is the responsibility of each foreign student to arrange accommodation during the exchange period. Students usually choose between three types of accommodation: republics, kitnets, pensionatos.","交換學校一覽表所列之語言能力為該校之最低門檻要求，同學需自行確認語言能力是否符合該校修課要求、查詢是否有相對應系所及足夠的課程可供選讀、能否達到該校之每學期修課學分數要求、以及是否具備相關領域之背景知識，若未達標準，該校有權拒收 交換計畫資訊請參考 此連結 [https://internationaloffice.unicamp.br/en/estudantes-intercambistas-internacionais/#Informa%C3%A7%C3%B5es-de-Interc%C3%A2mbio] 課程資訊請參考 此連結 [https://www.dac.unicamp.br/portal/caderno-de-horarios/] 及 此連結 [https://www.dac.unicamp.br/portal/graduacao/catalogos-de-cursos] (If the appropriate semester’s schedule is not yet available, students should pick their classes based on the same semester from the year before.) Please note, Master's/PhD students need to make two applications . Classes are offered at four different Campuses, in three different cities. We strongly recommend that students take classes in one city. FCA and FT are in Limeira and FOP is in Piracicaba. All undergraduate classes and most graduate classes are offered in Portuguese. Areas with restrictions: Medicine [https://www.fcm.unicamp.br/fcm/international-office] : Only theory courses (up to two courses, one month each, upon Coordinator approval) Music: Only for Music major applicants, especially instrument classes. Art Courses: Only for Art major applicants. Sports Courses: Only for Sports major applicants. Thesis and final projects: most units do not accept students for thesis and final projects, even if no exam is required. Language Courses: Only Portuguese for foreigners or Portuguese for Spanish speakers, and ONLY if the student takes the placement test prior to the beginning of classes. Course Load: Up to 32 credits for non-degree students from Partner Universities. Portuguese for foreigners and Portuguese for Spanish speakers: semester-long and are free of charge. However, availability is limited and enrollment is not guaranteed. In addition, only students who arrive in time for the placement interview (offered the week prior to the beginning of classes) are able to enroll. Classes are offered ONLY in Campinas. Estimated cost of living: Students usually spend around US$400 - 600 per month. This amount includes housing and food costs. UNICAMP requires that all foreign students have international health insurance. It is advisable for students to take out medical insurance with an insurance company in their home country that provides coverage abroad. Cost of living: around US$400-600 a month During the semester, Unicamp offers the following classes: Portuguese for foreigners and Portuguese for Spanish speakers. They are semester-long and free of charge. However, availability is limited and enrollment is not guaranteed. In addition, only students who arrive in time for the placement interview (offered the week prior to the beginning of classes) are able to enroll. Classes are offered ONLY in Campinas.",-22.822656,-47.0627959
955,日本大學,Nihon University,日本,Japan,https://oia.ntu.edu.tw/outgoing/view/semester/1/sn/955,是,日語組,GPA 達3.30分以上,大二以上/碩一以上/博一以上學生,具日文檢定成績 2 級以上,醫學院、牙醫學院、松戶牙醫學院、藥學系、獸醫學系、社會文化學研究所、國際政治經濟研究所、文化傳播學研究所、人類科學研究所、社會文化學博士學程、法律學系、體育科學院,一學期1名,Fall semester: September - February Spring semester: April - July,須在本校註冊並繳交全額學雜費，免繳該校學費，但該校雜費、住宿費、生活費、保險費、往返機票費等均須自行負擔,"不保證住宿。 Housing information is provided by Student Affairs Section of the college or graduate school at which you have been accepted . Since Nihon University has campuses in various locations, dormitories are not provided. But there are various types of private houses near every campus. International students may select a house that suits their budget and lifestyle.","交換學校一覽表所列之語言能力為該校之最低門檻要求，同學需自行確認語言能力是否符合該校修課要求、查詢是否有足夠的課程可供選讀、能否達到該校之每學期修課學分數要求、以及是否具備相關領域之背景知識，若未達標準，該校有權拒收 交換生資訊請參考 此連結 [http://www.nihon-u.ac.jp/en/] 、課程資訊請參考 此連結 [https://www.nihon-u.ac.jp/] 、Brochure請參考 此連結 [https://www.d-pam.com/nihon-u/2514631/index.html?tm=1#target/page_no=1] Departments/programs/faculties/schools NOT open to exchange students: School of Medicine School of Dentistry School of Dentistry at Matsudo School of Pharmacy Department of Veterinary Medicine Graduate School of Social and Cultural studies International Political Science and Economics (Master’s Program Only) Culture and Communication Studies (Master’s Program Only) Human Science (Master’s Program Only) Social and Cultural Studies (Doctor’s Program Only) Law School College of Sports Sciences Not only master and Ph.D but also Bachelor program, please specify what you would like to study or reseach in the field of department or major you applied, apart from learning Japanese or Japanese culture. Otherwise we cannot appoint supervisor properly and sometimes it will lead to rejection of your applciation. Estimated cost of living: ¥35,000 per month plus utilities fee (approx. ¥10,000 per month)",35.6971554,139.7625818
958,龐貝法布拉大學,Pompeu Fabra University,西班牙,Spain,https://oia.ntu.edu.tw/outgoing/view/semester/1/sn/958,是,西語組,無,大二以上(僅限大學部)學生,TOEFL iBT 79 (接受 Home Edition) 或 IELTS 6.0 或 全民英檢中高級；或具西語檢定成績 B1(中級) 級以上,無,全學年2名,Academic Calendar [https://www.upf.edu/web/incoming/exchange-students-academic-information] (> Academic calendar) It is divided in three terms: September – December | January – March | April – June Each term consists of 10 weeks of classes and 2 weeks for the exams. Orientation days are planned to welcome exchange students at the beginning of each term. Attendance to these sessions is compulsory. *請特別留意該校為三學期制，本學期甄選錄取者交換期為該校Term1,須在本校註冊並繳交全額學雜費，免繳該校學費，但該校雜費、住宿費、生活費、保險費、往返機票費等均須自行負擔,"The Mobility and Reception Office does not provide any accommodation service directly. However, UPF is a member of the BCU, a public service that assists international students coming to Barcelona. It manages the BCU Housing Service [https://www.bcuhousing.cat/en] with a wide range of flats and rooms to rent and information about student residence halls. UPF has direct agreements with some residence halls . More information check here [https://www.upf.edu/web/barcelona/allotjament] .","交換學校一覽表所列之語言能力為該校之最低門檻要求，同學需自行確認語言能力是否符合該校修課要求、查詢是否有相對應的系所及足夠的課程可供選讀、能否達到該校之每學期修課學分數要求、以及是否具備相關領域之背景知識，若未達標準，該校有權拒收。 Courses are taught in English, Spanish or Catalan. Website [https://www.upf.edu/web/incoming/exchange-students] of incoming exchange students information Academic information [https://www.upf.edu/web/incoming/exchange-students-academic-information] Usual workload: 60 ECTS per year - 20 ECTS per term. Exchange students can enrol in Spanish and Catalan courses at the Languages UPF programme [https://www.upf.edu/pei/] . There are specific courses targeting UPF exchange students at a reduced price.",41.4043275,2.1937054
961,高麗大學,Korea University,南韓,South Korea,https://oia.ntu.edu.tw/outgoing/view/semester/1/sn/961,是,韓語組,GPA 達2.70分以上,大二/大三/大四學生,TOEFL iBT 79 (不接受 Home Edition) 或 IELTS 6.0；或具韓語檢定(TOPIK)成績 4 級以上,醫學系、護理學系、藥學系、法律系、師範教育、資訊安全學系、藝術與設計學系、商業研究所課程及世宗校區所有課程,一學期1名,該校年曆請參考 此連結 [https://gsc.korea.ac.kr/usr/exchange/overview.do] Fall semester: September - December Spring semester: March - June,須在本校註冊並繳交全額學雜費，免繳該校學費，但該校雜費、住宿費、生活費、保險費、往返機票費等均須自行負擔,"不保證住宿，住宿資訊請參考此連結 [https://dorm.korea.ac.kr/]。
交換生語言課程資訊，請參考此連結 [https://gsc.korea.ac.kr/usr/exchange/notice_list.do]。
獎學金資訊請參考此連結 [https://gsc.korea.ac.kr/usr/exchange/scholarships.do]
保險資訊 [http://gsc.korea.ac.kr/usr/exchange/insurance.do]：All the international students are required to have their private insurance that covers their whole stay in Korea prior to beginning their studies at KU.　","交換學校一覽表所列之語言能力等規定為該校之最低門檻，同學需自行確認最新資訊，如語言能力及成績是否符合該校要求、查詢是否有足夠的課程可供選讀、能否達到該校之每學期修課學分數要求、以及是否具備相關領域之背景知識等，若未達標準，該校有權拒收。本表所提供之資訊如有與交換學校／國家／地區最新公告不符之處，申請學生應以交換學校／國家／地區之最新公告為準。 經甄選錄取獲得本校推薦資格之交換生，不得於取得該校入學許可後，要求變更已取得的入學許可條件；或者是交換申請被該校拒絕後，要求以另一種條件重新提出申請。如有以上情事者，將直接取消其錄取資格。 交換學生資訊請參考 此連結 [https://gsc.korea.ac.kr/usr/exchange/overview.do] 、 Fachsheet [https://gsc.korea.ac.kr/usr/exchange/notice_list.do] 課程資訊請參考 此連結 [https://gsc.korea.ac.kr/usr/exchange/after_acceptance.do] (Step 3. Course Registration) Medicine, Nursing, Pharmacy, Law, Teacher Education, Division of Information Security, Art & Design, graduate level Business courses (graduate courses that start with BUS, INT) and all courses at Sejong Campus are not open to exchange students. Please be aware that registering for courses from Business School, Media & Communications, and International Studies (courses that start with BUSS, JMCO, DISS) is extremely competitive. Our office cannot guarantee any specific courses for exchange students and we ask students to be very flexible with their course selections. Academic workload: ．Undergraduates: Max.19 credits per semester ．Postgraduates: Max.12 credits per semester Cost of Living [https://gsc.korea.ac.kr/usr/service/student_life.do] : around KRW 1,000,000~1,200,000 ($850~1020) per month",36.6108894,127.2934174
968,薩拉曼卡大學,University of Salamanca,西班牙,Spain,https://oia.ntu.edu.tw/outgoing/view/semester/1/sn/968,是,西語組,無,大二以上/碩一以上(不含博士生)學生,具西語檢定成績 B1(中級) 級以上,無,全學年2名,Academic Calendar [https://cursosinternacionales.usal.es/en/calendarios] 1st semester: September - February 2nd semester: February - June,須在本校註冊並繳交全額學雜費，免繳該校學費，但該校雜費、住宿費、生活費、保險費、往返機票費等均須自行負擔,Students must arrange for housing on their own with Housing Office support. More information on Residence Halls [https://colegioscomedores.usal.es/] / Private accommodation [https://spio.usal.es/],"交換學校一覽表所列之語言能力為該校之最低門檻要求，同學需自行確認語言能力是否符合該校修課要求、查詢是否有相對應的系所及足夠的課程可供選讀、能否達到該校之每學期修課學分數要求、以及是否具備相關領域之背景知識，若未達標準，該校有權拒收。 該校絕大多數為西語授課，同學須具備相當之西語能力。 Website [https://rel-int.usal.es/en/students/incoming-students/information-for-incoming-mobility-students] of incoming exchange student information Course catalogue [https://www.usal.es/grados] Health Sciences Areas, and Global Studies Degree, require previous consultation.",40.9621455,-5.6690588
