361,梨花女子大學,Ewha Womans University,南韓,South Korea,https://oia.ntu.edu.tw/outgoing/view/semester/1/sn/361,是,韓語組,GPA 達3.30分以上,大二以上/碩一以上(不含博士生)學生,TOEFL iBT 79 (不接受 Home Edition) 或 IELTS 6.0；或具韓語檢定(TOPIK)成績 3 級以上,護理學系、醫學系、藥學系,全學年2名,該校年曆請參考 此連結 [http://www.ewha.ac.kr/ewhaen/bachelor/calendar2023.do?mode=user_list&year=2024] Fall Semester: September - December Spring Semester: March - June,須在本校註冊並繳交全額學雜費，免繳該校學費，但該校雜費、住宿費、生活費、保險費、往返機票費等均須自行負擔,不保證住宿 ，住宿資訊請參考 此連結 [http://oia.ewha.ac.kr/oia/1147/subview.do] 。,"交換學校一覽表所列之語言能力等規定為該校之最低門檻，同學需自行確認最新資訊，如語言能力及成績是否符合該校要求、查詢是否有足夠的課程可供選讀、能否達到該校之每學期修課學分數要求、以及是否具備相關領域之背景知識等，若未達標準，該校有權拒收。本表所提供之資訊如有與交換學校／國家／地區最新公告不符之處，申請學生應以交換學校／國家／地區之最新公告為準。 經甄選錄取獲得本校推薦資格之交換生，不得於取得該校入學許可後，要求變更已取得的入學許可條件；或者是交換申請被該校拒絕後，要求以另一種條件重新提出申請。如有以上情事者，將直接取消其錄取資格。 該校雖是女子學校，但是交換學生計畫是男女學生皆可申請。 交換資訊請參考 此連結 [http://oia.ewha.ac.kr/oia/1142/subview.do] Fact Sheet 請參考 此連結 [https://drive.google.com/file/d/1pMp7Kh9Du9oQTysiDjGf2_3N-bZHZ_Of/view?usp=sharing] 課程資訊請參考 此連結 [https://eureka.ewha.ac.kr/eureka/my/public.do?pgId=P531005520] Couse Restriction: Restriction may apply to Art & Design, Music, ELTEC Engineering, Education, Scranton Honors Program, and HOKMA College of General Education. Nursing, Medicine, Pharmacy are not available. The Graduate School courses are available. Some courses in the Graduate School of International Studies are available. English-taught courses of School of Law are available. Courses in the Graduate School of Business courses are available for graduate students only. The Professional Schools, the Special Graduate Schools are not available, except those mentioned above. Minimum Workload: 9 Ewha credits for undergraduates, 6 Ewha credits for graduates. ＊Credit Bearing(applied at regular course registration period) with no additional fee. Insurance: Students must have overseas health insurance, which covers their study period at Ewha. Students may choose Ewha's collective insurance plan. If not, students must provide a proof of insurance, which is compatible with Ewha's collective insurance.",37.5643371,126.9468925
364,猶他大學,The University of Utah (U of U),美國,United States,https://oia.ntu.edu.tw/outgoing/view/semester/1/sn/364,是,一般組,GPA 達2.60分以上,大二以上(僅限大學部)學生,TOEFL iBT 80 (不接受 Home Edition) 或 IELTS 6.5,醫學院、法律學院、護理學院、藥學系、牙醫學院,全學年2名,Fall Semester: August - December Spring Semester: January - April ✔ 該 校年曆請參考 此連結 [https://registrar.utah.edu/academic-calendars/],須在本校註冊並繳交全額學雜費，免繳該校學費，但住宿費、生活費、保險費、往返機票費等均須自行負擔,保證校內住宿 ，住宿資訊請參考 此連結 [https://www.housing.utah.edu/apply-reserve/rates-n-housing-account/] All exchange students are REQUIRED to live on campus. Learning Abroad will assist you in arranging your on-campus housing.,"交換學校一覽表所列之語言能力為該校之最低門檻要求，同學需自行確認語言能力是否符合該校修課要求、查詢是否有相對應系所及足夠的課程可供選讀、能否達到該校之每學期修課學分數要求、以及是否具備相關領域之背景知識，若未達標準，該校有權拒收 交換生資訊請參考 此連結 [https://learningabroad.utah.edu/incoming-exchange/welcome.php] 及 Fact Sheet [https://studyabroad.ntu.edu.tw/wp-content/uploads/2023/09/Incoming-Exchange-Fact-Sheet-2024.pdf] （僅供參考）、課程資訊請參考 此連結 [https://registrar.utah.edu/Catalog-schedules.php] 在具備相關領域之背景知識及選課標準的前提下，交換學生可跨領域選課。 Please note, a ll students regardless of status at home university will be coded as undergraduate students . All exchange students are required to the prerequisite requirements for the courses they plan on taking. Incoming exchange students are not allowed to take any coursework in the School of Medicine, College of Nursing, College of Pharmacy, School of Dentistry, and the College of Law. Exchange students MUST enroll in a minimum of 12 credit hours to comply with USA visa regulations University of Utah Health Insurance [http://studenthealth.utah.edu/international-students/index.php] is required of all international exchange students and that the applicant must pay their insurance bill by the tuition due date Exchange students are responsible for differential fees that are charged by certain departments on campus . Estimated cost of living [https://financialaid.utah.edu/tuition-and-fees/cost-of-attendance.php]",40.7628137,-111.8368719
366,威斯康辛大學麥迪遜分校,University of Wisconsin-Madison (UW-Madison),美國,United States,https://oia.ntu.edu.tw/outgoing/view/semester/1/sn/366,是,一般組,無,大二以上/碩一以上/博一以上學生,TOEFL iBT 95 (不接受 Home Edition) 或 IELTS 6.5,醫學院、法律學院、生物資源暨農學院獸醫學系、生物資源暨農學院獸醫學研究所、管理學院,全學年2名,Fall Semester: September - December Spring Semester: January - May ✔ 該校年曆請參考 此連結 [https://studyabroad.wisc.edu/exchange/semester-dates-timeline/],須在本校註冊並繳交全額學雜費，免繳該校學費，但住宿費、生活費、保險費、往返機票費等均須自行負擔,不保證住宿 ，住宿資訊請參考 此連結 [https://studyabroad.wisc.edu/exchange/housing/],"交換學校一覽表所列之語言能力為該校之最低門檻要求，同學需自行確認語言能力是否符合該校修課要求、查詢是否有相對應系所及足夠的課程可供選讀、能否達到該校之每學期修課學分數要求、以及是否具備相關領域之背景知識，若未達標準，該校有權拒收 交換生資訊請參考 此連結 [https://studyabroad.wisc.edu/exchange/] 課程資訊請參考 此連結 [https://studyabroad.wisc.edu/exchange/course-enrollment/] Please note that exchange students are rarely, if ever, allowed to enroll in courses from UW-Madison professional schools (Medicine, Veterinary Medicine, Pharmacy, Nursing, Law, Education, etc). Some courses (for example, Economics) are open to exchange students, but are very popular and fill quickly during enrollment time. Business Exchange students receive priority enrollment for courses in the Wisconsin School of Business. Therefore, if you are not participating on a Business Exchange Program you may have to wait until after the regular enrollment period is complete or even until you arrive in Madison to enroll in these courses. Many business courses fill up quickly. IAP and Engineering exchange students should not assume they can enroll in business courses when making decisions about whether to attend the UW-Madison exchange program. Our Computer Sciences (CS) courses can be challenging to enroll in due to space constraints. Many of our CS courses fill up quite quickly before our exchange students are even eligible to enroll. Additionally, due to the extensive homework and high expectations in these courses, the department strongly suggests that students take no more than two CS courses in a semester. Minimum academic workload per semester: Undergraduate: 12-18 credits Graduate: 8-15 credits Insurance [https://studyabroad.wisc.edu/exchange/insurance/] : All international students, including exchange applicants, are required to purchase the UW-Madison Student Health Insurance Plan.",43.0802745,-89.4309587
368,伊利諾大學香檳分校,University of Illinois at Urbana-Champaign (UIUC),美國,United States,https://oia.ntu.edu.tw/outgoing/view/semester/1/sn/368,是,一般組,GPA 達3.30分以上,大二/大三/大四/碩一/碩二(不含博士生)學生,TOEFL iBT 80 (不接受 Home Edition) 或 IELTS 6.0 (聽 6.0 讀 6.0 寫 6.0 說 6.0)；社會科學院社會工作學系學生需符合TOEFL iBT 103 (不接受 Home Edition) 或 IELTS 7.5 (聽 7.0 讀 7.0 寫 7.0 說 7.0)之成績標準,管理學院、工學院、電機資訊學院、法律學院、生物資源暨農學院獸醫學系、醫學院,全學年2名,Fall Semester: August - December Spring Semester: January - May ✔ 該校年曆請參考 此連結 [https://registrar.illinois.edu/academic-calendars/],須在本校註冊並繳交全額學雜費，免繳該校學費，但住宿費、生活費、保險費、往返機票費等均須自行負擔,"不保證住宿 ，住宿相關資訊請參考 此連結 [https://studyabroad.illinois.edu/incoming-students/accepted-students/#:~:text=arrive%20on%20campus.-,HOUSING,-You%20are%20responsible]","交換學校一覽表所列之語言能力為該校之最低門檻要求，同學需自行確認語言能力是否符合該校修課要求、查詢是否有相對應系所及足夠的課程可供選讀、能否達到該校之每學期修課學分數要求、以及是否具備相關領域之背景知識，若未達標準，該校有權拒收 交換生資訊請參考 此連結 [https://las.illinois.edu/resources/international/incoming/exchange] 、課程資訊請參考 此連結 [https://courses.illinois.edu/schedule] （Spring 2024起） Students will apply through the College of Liberal Arts and Sciences (starting Spring 2024) ; however, they will be allowed to take courses in most departments on campus. Exceptions (Restricted Programs) are: College of Business (ACCY, BADM, and FIN courses) Department of Bioengineering Department of Computer Sciences Division of General Studies Graduate College School of Labor and Employment Relations College of Law School of Information Sciences College of Medicine Department of Recreation, Sport, and Tourism (online graduate courses only) Technology and Information Management Program College of Veterinary Medicine Any internships, co-op programs, or teaching practicums in local schools. Limited Programs: Courses within the following departments/colleges experience high demand . Consequently, you will need to be flexible when choosing courses from these departments: Department of Advertising Department of Mechanical Science and Engineering Architecture (College of Fine & Applied Arts)—limited access to studio classes College of Education Electrical and Computer Engineering (College of Engineering) Department of Journalism Kinesiology (College of Applied Health Sciences)—some limitations Landscape Architecture (College of Fine & Applied Arts) Workload: at least 12 credit hours per semester for Master's students, they are allowed to take undergraduate courses/subjects/units It is possible to take courses from different areas, but it is recommended to stay within the college the student is applying. We determine which academic college the student will be placed in when reviewing the tentative course list in their application. If a student would like to take all ENGR courses, they need to add this to their tentative course list to be added to the ENGR academic college. Graduate students will be admitted to the University of Illinois as undergraduates , but they will be able to take advanced undergraduate and graduate-level course work at Illinois. Incoming Exchange Student Fees [https://studyabroad.illinois.edu/incoming-students/incoming-student-finances/] Students will be required to attend a mandatory orientation on the Monday of the week prior to the official start of the semester. Cost of living [https://cost.illinois.edu/Home/Cost/N/G/Compare/12/120228/120228] : $9,800 for one semester or $19,600 for two semesters (for reference only) Insurance Information [https://si.illinois.edu/] 註：Fall 2023及之前之交換生資訊請參考 此連結 [https://aces.illinois.edu/academics/study-abroad/get-started] 、課程資訊請參考 此連結 [https://app.studyabroad.illinois.edu/index.cfm?FuseAction=Programs.AdvancedSearch]",40.0761545,-88.2233134
371,伯恩大學,University of Bern,瑞士,Switzerland,https://oia.ntu.edu.tw/outgoing/view/semester/1/sn/371,是,德語組,無,大二以上/碩一以上/博一以上學生,TOEFL iBT 80 (寫 17 不接受 Home Edition) 或 IELTS 6.0 (寫 6.0) 或 全民英檢中高級；或具德語檢定成績 B2(中高級) 級以上,醫學院、公共衛生學院、生物資源暨農學院獸醫學系、生物資源暨農學院獸醫學研究所、生物資源暨農學院臨床動物醫學研究所,全學年2名,Academic Calendar [https://www.unibe.ch/studies/dates/semesterdates/index_eng.html],須在本校註冊並繳交全額學雜費，免繳該校學費，但該校雜費、住宿費、生活費、保險費、往返機票費等均須自行負擔,"The dorm providers in Bern are not linked to the university, they are private providers. For this reason, we cannot guarantee housing, however, we send studentsan info sheet on all the available options in Bern (dorms, shared-flat platforms etc.). More information here [https://www.unibe.ch/studies/mobility/incoming/general_information/accommodation___living/index_eng.html] .","交換學校一覽表所列之語言能力為該校之最低門檻要求，同學需自行確認語言能力是否符合該校修課要求、查詢是否有 相對應的系所及 足夠的課程可供選讀、能否達到該校之每學期修課學分數要求、以及是否具備相關領域之背景知識，若未達標準，該校有權拒收。 Website [https://www.unibe.ch/studies/mobility/incoming/general_information/index_eng.html] of incoming exchange student information List of Courses [https://www.ksl.unibe.ch/KSL/veranstaltungen?1] NOT open to exchange students: Faculty of Medicine, Veterinary Medicine 該校英語授課課程有限，僅具有英語能力之同學須自行評估是否有課程可供選讀 。 Most courses for bachelor students are taught in German. Most classes in English are at Master level. Bachelor exchange students are welcome to also sign up for Master courses (there may be some exceptions regarding Master seminars). The language of instruction is mentioned in the course catalogue. Students should have sufficient proficiency of German and/or English to be able to follow lectures and written exams (CEFR level B2; CEFR level C1 for courses at the English Department). For PhD students we have special requirements: PhD students are asked to find a professor at the University of Bern, who will act as their supervisor during the time of their stay in Bern. Only with this support, we can accept exchange students on PhD level. For exchange students, a credit load of 20-25 ECTS/semester is recommended.",46.9509726,7.4386841
374,冰島大學,University of Iceland,冰島,Iceland,https://oia.ntu.edu.tw/outgoing/view/semester/1/sn/374,否,一般組,無,大二以上/碩一以上/博一以上學生,TOEFL iBT 79 (不接受 Home Edition) 或 IELTS 6.5,法律學院法律學系、社會科學院經濟學系、管理學院企業管理碩士專班、理學院心理學系、理學院心理學研究所、醫學院、公共衛生學院,全學年1名,Academic Calendar [https://english.hi.is/study/study-information/academic-calendar],須在本校註冊並繳交全額學雜費，免繳該校學費，但該校雜費、住宿費、生活費、保險費、往返機票費等均須自行負擔,The University of Iceland does not provide or guarantee housing for students but information on this website [https://english.hi.is/study/living-iceland/housing] may be helpful.,"交換學校一覽表所列之語言能力為該校之最低門檻要求，同學需自行確認語言能力是否符合該校修課要求、查詢是否有相對應的系所及足夠的課程可供選讀、能否達到該校之每學期修課學分數要求、以及是否具備相關領域之背景知識，若未達標準，該校有權拒收 Website [https://english.hi.is/study/study-abroad/incoming-exchange-students] of incoming exchange student information Courses offered for exchange students [https://ugla.hi.is/kennsluskra/index.php?tab=nam&chapter=exhange_course_list] Courses with restrictions for exchange students: The faculties of Medicine, Nursing, Psychology and Pharmaceutical Sciences are restricted to prior agreements between the exchanging faculties. The faculties of Law and Economics do not accept undergraduate students MBA is closed Admission to the Earth Science programme is restricted to students that meet prerequisites of at least one year of geology or geophysics study. Courses in the English Language Programme are only available to exchange students majoring in English at their home university or students who are very proficient in English (except the course ""English for Practical Purposes"") Courses taught in Icelandic are generally not open to exchange students Course selection must total 30 ECTS credits per semester, where at least 60% of courses are within the students' major",64.1401831,-21.9539633
375,烏普薩拉大學,Uppsala University,瑞典,Sweden,https://oia.ntu.edu.tw/outgoing/view/semester/1/sn/375,否,一般組,無,大二以上/碩一以上/博一以上學生,TOEFL iBT 92 (接受 Home Edition) 或 IELTS 6.5 或 全民英檢中高級,社會科學院經濟學系、社會科學院經濟學研究所,全學年1名,Academic Calendar [https://www.uu.se/en/study/higher-education-in-sweden],須在本校註冊並繳交全額學雜費，免繳該校學費，但該校雜費、住宿費、生活費、保險費、往返機票費等均須自行負擔,"Housing [https://housingoffice.se/] is not guaranteed, but accommodation is offered for exchange students based on the following conditions: 1. The exchange agreement is relatively well balanced with regard to incoming / outgoing students. 2. The application for housing in Uppsala is submitted on time and the student has accepted the offer by the deadline specified in the housing offer.","交換學校一覽表所列之語言能力為該校之最低門檻要求，同學需自行確認語言能力是否符合該校修課要求、查詢是否有 相對應的系所及 足夠的課程可供選讀、能否達到該校之每學期修課學分數要求、以及是否具備相關領域之背景知識，若未達標準，該校有權拒收。 Website [https://www.uu.se/en/study/exchange-studies] for incoming exchange student information. Useful information about courses for exchange students is listed here [https://www.uu.se/en/study/search?category=coursesForExchangeStudents] : 60 credits should be selected in order to have reserve options. Please note, the Swedish Migration Agency requires students to be accepted to full–time studies to issue residence permits for non-EU/EES students. Full-time study means 30 credits (or higher education points) per term . You cannot receive a residence permit for distance learning or online courses. Restricted subject areas for exchange students: Business Studies – entry requirements vary considerably and are generally high. Master level courses require a finished Bachelor's degree majoring in business. Biomedicine – Students must have a very strong academic background. Limited space. Economics – no courses available from the Department of Economics. Government – limited space on certain courses History – limited space on certain courses. Law – entry requirement is a minimum of two years of completed full time Law studies. Medicine – Clinical Medicine courses are not offered on university-wide exchange agreements. No entry-level courses taught in English. Students must have a strong academic background within Medicine and meet the entry requirements described in the course description. Natural Sciences including Physics, Chemistry, Biology and Engineering - few to no entry-level courses taught in English. Students must have a very strong academic background within these subjects and meet the entry requirements described in the course description. Pharmacy – Students must have a very strong academic background. Limited space. Philosophy – only few courses available with high entry requirements. Psychology – only few courses, on a basic level, taught in English with very limited space on courses. Sociology – only few courses available with high entry requirements. Please note: there is NO add-and-drop period at Uppsala University.",59.8576363,17.6294616
376,青山學院大學,Aoyama Gakuin University,日本,Japan,https://oia.ntu.edu.tw/outgoing/view/semester/1/sn/376,是,日語組,GPA 達3.00分以上,大二以上/碩二(不含博士生)學生,具日文檢定成績 2 級以上,體育課程、教師證照課程、日文學生外語課程、教育學院部分課程,一學期1名,Fall Semester: September - February Spring Semester: April - August ✔️ 該校行事曆請見 此連結 [https://www.aoyama.ac.jp/en/campuslife/academic_calendar.html],須在本校註冊並繳交全額學雜費，免繳該校學費，但該校雜費、住宿費、生活費、保險費、往返機票費等均須自行負擔,不保證住宿 ，住宿資訊請參考 此連結 [https://www.aoyama.ac.jp/en/admission/exchange/housing_exchange_program.html] 。,"交換學校一覽表所列之語言能力為該校之最低門檻要求，同學需自行確認語言能力是否符合該校修課要求、查詢是否有足夠的課程可供選讀、能否達到該校之每學期修課學分數要求、以及是否具備相關領域之背景知識，若未達標準，該校有權拒收 交換資訊請參考 此網頁 [https://www.aoyama.ac.jp/en/admission/exchange/] 、 Brochure [https://www.aoyama.ac.jp/wp-content/uploads/2023/11/A-Guide-For-International-Exchange-Students.pdf] 及 Fact Sheet [https://studyabroad.ntu.edu.tw/wp-content/uploads/2024/11/AGU_Fact_Sheet_2025.pdf] 、課程資訊請參考 此連結 [https://www.aoyama.ac.jp/en/admission/exchange/course.html] 在具備相關領域之背景知識及選課標準的前提下，交換學生可跨領域選課，研究所學生可選修大學部課程。 International Program for Japan Studies [https://www.aoyama.ac.jp/en/academic/foreigner/jcb/] Departments/programs/faculties/schools NOT open to exchange students: Physical Education classes, Teacher’s Certificate courses, Foreign Language courses for Japanese students, some courses offered by the Department of Education, and courses that are not open to the exchange students. Graduate students may be accepted on a limited basis subject to approval from the academic staff based on academic objectives. Most courses are taught in Japanese. Some Graduate Schools require a high level of Japanese language proficiency (JLPT N1 level). Minimum number of credits: 14 credits (10.5 hours) per semester. Health Insurance [https://www.aoyama.ac.jp/wp-content/uploads/2025/07/IC_20250724_FAQ-For-Exchange-Students.pdf] : All students are required to enter National Health Insurance (NHI).",35.6605744,139.7104162
