id,name_zh,name_en,country,country_en,url,開放第二次出國交換之同學選填,申請組別,GPA要求,年級限制,語言要求,不接受申請之學院,名額,學校年曆,註冊繳費,accommodation_info,注意事項,latitude,longitude
1,加拿大英屬哥倫比亞大學（卑詩大學）,The University of British Columbia (UBC),加拿大,Canada,https://oia.ntu.edu.tw/outgoing/view/semester/1/sn/1,是,一般組,GPA 達2.80分以上,大二以上/碩一以上(不含博士生)學生,TOEFL iBT 90 (讀 22 聽 22 說 21 寫 21 接受 Home Edition) 或 IELTS 6.5 (聽 6.0 讀 6.0 寫 6.0 說 6.0),新聞研究所、醫學院、法律學院、工學院、管理學院會計學研究所、管理學院財務金融學研究所、管理學院國際企業學研究所、管理學院資訊管理學研究所、管理學院商學研究所、管理學院企業管理碩士專班、理學院心理學研究所、社會科學院政治學研究所、文學院人類學研究所、社會科學院經濟學研究所、聽力學及語言病理學系、護理系、藥學系、復健科學系、UBC Vantage College,一學期4名,Vancouver 校 區： UBC Vancouver Academic Calendar [http://www.calendar.ubc.ca/vancouver/index.cfm?page=deadlines] Okanagan 校區： UBC Okanagan Academic Calendar [http://www.calendar.ubc.ca/okanagan/index.cfm?go=deadlines] Term 1: September - December Term 2: January - April,須在本校註冊並繳交全額學雜費，免繳該校學費，但該校雜費、住宿費、生活費、保險費、往返機票費等均須自行負擔,"不保證住宿 ，Vancouver校區住宿資訊請參閱 此連結 [https://vancouver.housing.ubc.ca/] 、Okanagan校區請參閱 此連結 [http://okanagan.housing.ubc.ca/] Go Global exchange students have priority access to on-campus housing through UBC Vancouver Student Housing. For details about on-campus housing including residences and fees, please visit the UBC Vancouver Student Housing website [https://vancouver.housing.ubc.ca/] . Please read this carefully before submitting your housing application. Although exchange students have priority access through dedicated spots for Go Global students, on-campus housing is NOT guaranteed due to high demand and limited space. Only 50-60% of students will receive an on-campus housing offer. Only students who submit the online housing application [https://secure.housing.ubc.ca/] by the deadline [https://goglobal.ubc.ca/node/2129] will be considered for a spot, determined by random lottery. Students with mobility-related disabilities and chronic medical conditions who have special housing needs should check the UBC Centre for Accessibility [https://students.ubc.ca/about-student-services/centre-for-accessibility] website to see whether they meet criteria for priority housing and apply by the stated deadlines. We strongly advise students to prepare a back-up plan for housing due to limited space. For other housing resources, including off-campus options, check the UBC Vancouver Housing Information Packet 2024/25 (PDF) [https://goglobal.ubc.ca/sites/default/files/documents/Housing%20Information%20Packet%202024-2025.pdf] .","交換學校一覽表所列之語言能力為該校之最低門檻要求，同學需自行確認語言能力是否符合該校修課要求、查詢是否有相對應系所及足夠的課程可供選讀、能否達到該校之每學期修課學分數要求、以及是否具備相關領域之背景知識，若未達標準，該校有權拒收 交換生資訊請參考 此連結 [https://goglobal.ubc.ca/go-global/coming-ubc/coming-ubc-exchange] 及 Fact Sheet [https://studyabroad.ntu.edu.tw/wp-content/uploads/2025/11/UBC-Factsheet-2026-2027-updated-Oct-2025.pdf] （僅供參考）、課程資訊： 選課資訊 [https://goglobal.ubc.ca/go-global/coming-ubc/coming-ubc-exchange/step-4-course-registration] 、 課程內容 [https://docs.google.com/spreadsheets/d/1RS0lWHl8HdeeWeEQb7ojeuCiT-cjHS-C/edit?usp=sharing&ouid=107278494206646461691&rtpof=true&sd=true] 本交換計畫開放申請該校 多個校區 [https://www.ubc.ca/our-campuses/] ， 校內甄選無須選擇校區 請注意該校每個系所限制皆不同，欲選填該校交換的同學，務必確認自己是否符合該校系所的申請資格：請參考 此連結 [https://goglobal.ubc.ca/go-global/coming-ubc/coming-ubc-exchange/step-4-course-registration] 選課時，請務必遵照該校信件及網站中的指示進行選課 Many graduate programs at UBC require higher Test of English as a Foreign Language (TOEFL) scores. If you are applying for graduate studies, please ensure that you meet the TOEFL scores [https://www.grad.ubc.ca/prospective-students/application-admission] listed. Minimum course load requirements: 9 credits per term (usually 3 courses) Taking graduate-level courses: If you want to take graduate-level courses, you must get permission from instructors and are required to complete the Enrolment of Undergraduate Exchange Students in Graduate Courses form after arrival. For details, please see the Graduate Studies restrictions page [https://goglobal.ubc.ca/node/3732] . Faculties or Schools Not Open to Exchange Students: School of Audiology and Speech Sciences School of Journalism Faculty of Medicine School of Nursing Faculty of Pharmaceutical Sciences School of Rehabilitation Sciences UBC Vantage College Peter A. Allard School of Law (only open to exchange students coming to UBC through Law-specific exchange agreements) At UBC, any course numbered 500 or above is considered a graduate-level course. While there are many programs that are available, some have limited enrolment are and restricted. Graduate programs NOT open to Go Global exchange and visiting students include: Commerce and Business Administration (e.g. MBA) Data Science Political Science Economics Counseling Psychology Anthropology Psychology Community and Regional Planning Faculty-Specific Restrictions: Some faculties and departments have course restrictions for exchange and visiting students. See here [https://goglobal.ubc.ca/go-global/coming-ubc/coming-ubc-exchange/step-4-course-registration] for details on course restrictions by faculty. University-wide e​​​​xchange students not admitted to the Sauder School of Business (e.g., admitted to Faculty of Arts or Faculty of Science) may request to take commerce courses, but enrolment is limited and not guaranteed. For more information, please see our page on studying commerce at UBC on exchange. Courses at the graduate level (500 and 600) are not available (e.g., Business Administration, EMBA courses) BUSI and COEC courses are not available COMM 101, 202, 271, 311, 466, 483, and dual degree courses (COMM 120, 126, 220, 320, 321, 420, and 421) are not available Limited enrolment in some 200-level (second year) courses The following are COMR courses for non-commerce majors: COMR 100, 280, 329, 398, 457, 458, 465, 473, and 493 Engineering: Priority access to Faculty of Applied Science (Engineering) courses will be given to students coming to UBC under Coordinated International Experience (CIE) or engineering-specific agreements. Only students pursuing a degree in engineering at their home university should be nominated to the Faculty of Applied Science at UBC. Engineering course registration often takes place at a later date than other registrations. UBC's Centre for Accessibility [https://students.ubc.ca/about-student-services/centre-for-accessibility] facilitates disability-related accommodations (such as alternate format materials, assistive technology, extra time allowance on an exam, etc.) designed to remove barriers for students with disabilities and ongoing medical conditions. To request an accommodation, students must register [https://students.ubc.ca/about-student-services/centre-for-accessibility/registering-centre-accessibility] with the Centre for Accessibility first. Costs Associated : UPass : $170 per term Medical Insurance: Please note that students will be automatically enrolled in the mandatory UBC iMED health insurance and will NOT be able to opt out even if they have coverage from their home country. For more information, please refer to here [https://students.ubc.ca/health/health-insurance/health-insurance-details-international/imed-temporary-health-insurance-international] . Single-term exchange: The cost is $315 CAD per term plus a $9.94 direct billing fee for iMED . If you are a single-term exchange student, iMED will cover you for the duration of your stay (approximately four months and one week). Full-year exchange: The cost is $225 CAD plus a $9.94 direct billing fee for iMED . The cost covers the three-month waiting period for the British Columbia Medical Services Plan (MSP). Students on exchange for six months or longer are required to apply for MSP. The MSP plan costs $75 CAD per month. The total cost of health insurance for Full-year exchange students is $609.94 CAD.",49.2484638,-123.2341555
2,維多利亞大學,University of Victoria (UVic),加拿大,Canada,https://oia.ntu.edu.tw/outgoing/view/semester/1/sn/2,是,一般組,無,大二以上/碩一以上(不含博士生)學生,TOEFL iBT 90 (讀 20 聽 20 說 20 寫 20 接受 Home Edition) 或 IELTS 6.5 (聽 6.0 讀 6.0 寫 6.0 說 6.0) 或 全民英檢中高級,管理學院、法律學院、工學院，部分教育、人類與社會發展、美術、工程,一學期2名,Fall Term: September - December Spring Term: January - April ✔ 該校年曆請參考 此連結 [https://www.uvic.ca/calendar/],須在本校註冊並繳交全額學雜費，免繳該校學費，但該校雜費、住宿費、生活費、保險費、往返機票費等均須自行負擔,不保證住宿，住宿資訊請參考 此連結 [https://www.uvic.ca/international/inbound-students/living-canada/housing-finance/index.php],"交換學校一覽表所列之語言能力為該校之最低門檻要求，同學需自行確認語言能力是否符合該校修課要求、查詢是否有相對應系所及足夠的課程可供選讀、能否達到該校之每學期修課學分數要求、以及是否具備相關領域之背景知識，若未達標準，該校有權拒收 交換學生資訊請參考 此連結 [https://www.uvic.ca/international/inbound-students/exchange/index.php] 、 Fact Sheet [https://www.uvic.ca/international-experiences/_assets/docs/uvic-exchange-fact-sheet-2026-2027.pdf] 及 Brochure [https://www.canva.com/design/DAF6KrYObt8/CRgb3-Fpi8sjpGkYHZA0pg/view?utm_content=DAF6KrYObt8&utm_campaign=designshare&utm_medium=link&utm_source=editor#1] （僅供參考） 課程資訊請參考 此連結 [https://www.uvic.ca/calendar/undergrad/index.php] （右側選單：> Courses）、語言課程請參考 此連結 [https://continuingstudies.uvic.ca/elc] At UVic, the International Centre for Students (ICS) [https://www.uvic.ca/international/inbound-students/contact/iss/index.php] operates an exchange program for the Faculties of Humanities, Science and Social Sciences, while the School of Business [http://www.uvic.ca/gustavson/international/international/incoming/index.php] and Faculty of Law [http://www.uvic.ca/law/admissions/upperyearstudents/exchangeapplicants/index.php] operate separate exchange programs. Inbound ICS exchange students are restricted from enrolling in any courses in the following departments: Civil Engineering (CIVE) Law (LAW) Limited courses are available to inbound ICS exchange students in the following departments: Business Education Human and Social Development Fine Arts Engineering (Software, Mechanical, Computer, Biomedical, Electrical) Minimum Course Registration Requirement: Exchange students living in on-campus housing must be registered in a minimum of 4.5 UVic units per term. Cost of living: varies each year (approx. $1200/month for housing and food) Insurance [https://www.uvic.ca/international/inbound-students/living-canada/health-insurance/index.php] : All UVic students are required to have comprehensive coverage for the entire duration of their studies. Why UVic is the place to go on exchange [https://www.youtube.com/watch?v=1tW0kibp46g]",48.46206,-123.3114198
3,渥太華大學,University of Ottawa,加拿大,Canada,https://oia.ntu.edu.tw/outgoing/view/semester/1/sn/3,否,一般組,GPA 達3.00分以上；法律學院學生TOEFL iBT 100 (寫 24 不接受 Home Edition) 或 IELTS 7.0 (寫 6.5),大二以上/碩一以上(不含博士生)學生,TOEFL iBT 86 (寫 22 不接受 Home Edition) 或 IELTS 6.5 (寫 6.5)；法律學院學生TOEFL iBT 100 (寫 24 不接受 Home Edition) 或 IELTS 7.0 (寫 6.5),醫學院、教育學院、管理學院、部分必修課程,全學年0名,Fall Semester: September - December Spring Semester: January - April* ✔ 該校年曆請參考 此連結 [https://www.uottawa.ca/current-students/important-academic-dates-deadlines] ⚠️ 註：自113學年度起，該校僅開放第1學期甄選申請， 不開放第2學期甄選申請 （即僅開放Fall Semester）,須在本校註冊並繳交全額學雜費，免繳該校學費，但住宿費、生活費、保險費、往返機票費等均須自行負擔,"不保證住宿 ，住宿資訊請參考 此連結 [https://www2.uottawa.ca/current-students/incoming-exchange-students#:~:text=Step%203%3A-,Preparing,-to%20leave] (> Find housing) There’s no guarantee of on-campus accommodation for exchange students. We strongly recommend looking at off-campus housing first.","交換學校一覽表所列之語言能力為該校之最低門檻要求，同學需自行確認語言能力是否符合該校修課要求、查詢是否有相對應系所及足夠的課程可供選讀、能否達到該校之每學期修課學分數要求、以及是否具備相關領域之背景知識，若未達標準，該校有權拒收 交換生資訊請參考 此連結 [https://www.uottawa.ca/current-students/incoming-exchange-students] 及 Fact Sheet [https://studyabroad.ntu.edu.tw/wp-content/uploads/2025/06/FACT-SHEET_INCOMING-STUDENTS-EN-2024.pdf] （僅供參考）、課程資訊請參考 此連結 [https://catalogue.uottawa.ca/en/courses/] Graduate students have additional documents to supply as well as different language requirements. They can consult the page here [https://www.uottawa.ca/graduate-studies/programs-admission/apply/specific-requirements] . All uOttawa Faculties and Departments [https://catalogue.uottawa.ca/en/programs/] are open to exchange students except the Faculty of Medicine, the Faculty of Education and the Telfer School of Management (course codes ADM, MGT or MBA). Mandatory courses in some programs may be reserved for University of Ottawa students, and visiting international students are not eligible to take them. Minimum academic workload per semester: 12 units (4 courses) for undergraduate, 6 units (2 courses) for graduate Graduate course limit: Students accepted in a grad-level exchange program may take at most three (3) courses (5000 - 6000 level) per term. However, they may register for three (3) grad-level courses and one (1) undergrad-level course. Therefore, a maximum of four (4) courses per term, with a minimum of three (3) grad-level courses. Law Exchange: Please note that the Juris Doctor program is part of the University of Ottawa’s undergraduate-level programs (course codes CML 1000 -4000). Graduate students interested in studying at the same level must select courses from our Master of Law programs (course codes DCL 5000 – 6000). Faculty of Law, Common Law applicants must have : an overall score of 100 and a written score of 24 on the TOEFL test; or an overall score of 7 and a written score of 6.5 on the IELTS test Exchange students can register in English as a Second Language (ESL) and French as a Second Language (FLS) courses at no extra cost. It is possible to take both an ESL and an FLS course. Registration in selected ESL or FLS courses is determined by an online language placement test [https://olbi.uottawa.ca/tests/uottawa-test] . Insurance: UHIP [https://www2.uottawa.ca/current-students/health-insurance/coverage-card] health insurance is mandator y for all exchange students; no exception will be considered. Estimated cost of living [https://www.uottawa.ca/financial-aid-awards/financial-planning]",45.4225271,-75.6833904
4,多倫多大學,University of Toronto (U of T),加拿大,Canada,https://oia.ntu.edu.tw/outgoing/view/semester/1/sn/4,否,一般組,無,大二以上/碩一以上(不含博士生)學生,學士生 TOEFL iBT 89 (說 22 寫 22 不接受 Home Edition) 或 IELTS 6.5 (聽 6.0 讀 6.0 寫 6.0 說 6.0)；研究生 TOEFL iBT 93 (說 22 寫 22 不接受 Home Edition) 或 IELTS 7.0 (聽 6.5 讀 6.5 寫 6.5 說 6.5)；法律學院學生 TOEFL iBT 100 (讀 25 寫 25 不接受 Home Edition) 或 IELTS 7.0 (聽 6.5 讀 6.5 寫 6.5 說 6.5),無,一學期2名,Fall Term: September - December Spring Term: January - April ✔ 該校年曆請參考 此連結 [https://future.utoronto.ca/newly-admitted-students/important-dates/],須在本校註冊並繳交全額學雜費，免繳該校學費，但住宿費、生活費、保險費、往返機票費等均須自行負擔,不保證住宿 ，住宿資訊請參考 此連結 [https://inboundvisiting.utoronto.ca/inbound-exchange/admitted-students/] （ 各校區之 Housing Section ）,"交換學校一覽表所列之語言能力為該校之最低門檻要求，同學需自行確認語言能力是否符合該校修課要求、查詢是否有相對應系所及足夠的課程可供選讀、能否達到該校之每學期修課學分數要求、以及是否具備相關領域之背景知識，若未達標準，該校有權拒收 交換資訊請參考 此連結 [https://learningabroad.utoronto.ca/inbound-visiting/student-exchange-fact-sheet/] 選填志願前，請務必先行詳閱系所限制，自行評估是否符合該校規定 ：請參考 可交換系所 [https://inboundvisiting.utoronto.ca/schools/national-taiwan-university/] 。 研究生皆會提名至 School of Graduate Studies (SGS) [https://learningabroad.utoronto.ca/schools/national-taiwan-university/] 。 各學院語言要求不同，請務必先行確認： English Language Requirements [https://inboundvisiting.utoronto.ca/inbound-exchange/english-requirements/] Starting from 2024/2025AY, There have been small changes for TOEFL (minimum 22 in Speaking and Writing) requirements for undergraduate faculties. Insurance Information [https://inboundvisiting.utoronto.ca/inbound-exchange/admitted-students/] ( > Pay for Your Health Insurance (UHIP) ）",43.663462,-79.3977597
5,西門菲沙大學,Simon Fraser University (SFU),加拿大,Canada,https://oia.ntu.edu.tw/outgoing/view/semester/1/sn/5,是,一般組,無,大二以上/碩一以上(不含博士生)學生,學士生 TOEFL iBT 88 (讀 20 聽 20 說 20 寫 20 不接受 Home Edition) 或 IELTS 6.5 (聽 6.0 讀 6.0 寫 6.0 說 6.0)；研究生 TOEFL iBT 93 (讀 20 聽 20 說 20 寫 20 不接受 Home Edition) 或 IELTS 7.0 (聽 6.5 讀 6.5 寫 6.5 說 6.5),Restricted Subjects and Courses，詳情請見注意事項,一學期1名,Fall Term: September - December Spring Term: January - April ✔ 該校年曆請參考 此連結 [https://www.sfu.ca/students/calendar/2026/spring.html],須在本校註冊並繳交全額學雜費，免繳該校學費，但住宿費、生活費、保險費、往返機票費等均須自行負擔,不保證住宿 ，住宿資訊請參考 此連結 [https://www.sfu.ca/students/residences/apply/fall.html],"交換學校一覽表所列之語言能力為該校之最低門檻要求，同學需自行確認語言能力是否符合該校修課要求、查詢是否有相對應系所及足夠的課程可供選讀、能否達到該校之每學期修課學分數要求、以及是否具備相關領域之背景知識，若未達標準，該校有權拒收 交換生資訊請參考 此連結 [http://www.sfu.ca/students/exchange.html] 、 手冊 [https://studyabroad.ntu.edu.tw/wp-content/uploads/2025/10/SFU-Exchange-and-Study-Abroad-Brochure-2026-27.pdf] 、 Fact Sheet [https://studyabroad.ntu.edu.tw/wp-content/uploads/2025/10/SFU-Exchange-and-Study-Abroad-Fact-Sheet-2026_27-.pdf] 及 Virtual Campus Tour [https://www.sfu.ca/students/admission/tours-events/virtual-campus-tours.html] 、課程資訊請參考 此連結 [http://www.sfu.ca/students/exchange/academic-information.html] Graduate Students [http://www.sfu.ca/students/exchange/prospective/grads.html] : Graduate students follow the same application procedure; however, they have to provide extra documentation as below: Two academic references (a letter of support from your program supervisor is preferred, and one letter of support from a recent instructor) Curriculum vitae Research proposal (only for those students planning to pursue research while at SFU) 欲選填該校為志願的同學，請務必先行詳閱系所限制，自行評估是否符合該校規定： Restricted Subjects and Courses [https://www.sfu.ca/students/exchange/academic-information/restricted-subjects-and-courses.html] Minimum course load: Undergraduate study is 9 units (normally 3 courses) Graduate study is 6 units (normally 2 courses) or full-time research Generally all faculties are open, however uni-wide students may have limited access to Business courses. Charles Chang Institute for Entrepreneurship [https://studyabroad.ntu.edu.tw/wp-content/uploads/2023/12/Chang-Institute-Offering-for-Inbound-Students.pdf] : We are pleased to share a new opportunity to take innovation and entrepreneurship courses through SFU’s Charles Chang Institute for Entrepreneurship. Medical Insurance [https://www.guard.me/sfu] Financial Information [https://www.sfu.ca/students/financialaid/costs.html]",49.2767096,-122.917803
